{
  "changelog": [
    {
      "by": "ui ds init",
      "kind": "init",
      "note": "compiled from persona=data-dense-observatory",
      "ts": "2026-05-30T16:36:57.913Z"
    }
  ],
  "compiledHash": "sha256-_uk_NyEW2-shDaOnVGDcF47EVm3ACBBmHToDSE10dmQ",
  "createdAt": "2026-05-30T16:36:57.913Z",
  "generation": 1,
  "intent": "analytics dashboard for a logistics ops team — KPIs, live fleet table, charts",
  "name": "ops-dashboard",
  "persona": {
    "antiPatterns": [
      "decorative images",
      "large whitespace",
      "playful aesthetics",
      "rounded pill buttons",
      "serif fonts"
    ],
    "family": "functional-saas",
    "slug": "data-dense-observatory"
  },
  "registryHash": "sha256-SSt6U5_2txSLRWCLIhVJ2XMsW2WODUBMKGFj44qhvZI",
  "version": "1.0.0"
}
