{
  "changelog": [],
  "compiledHash": "sha256-NX7PqN9LAIrckgogE6iGbwwnpPekH678cQS583nIQMU",
  "createdAt": "2026-10-01T00:00:00.000Z",
  "generation": 1,
  "intent": "Synthetic fixture for guideline tests.",
  "name": "lumen",
  "persona": {
    "family": "calm",
    "slug": "calm-ledger"
  },
  "registryHash": "sha256-jNiBbEasBrMFvjsNaQZcHxNSo4qkij9e3Nr_na7rb8Y",
  "version": "1.0.0"
}
